<?xml version="1.0" encoding="UTF-8"?>
<!DOCTYPE employees SYSTEM "employees.dtd">
<employees>
	<employee>
		<employee_id></employee_id>
		<first_name></first_name>
		<last_name></last_name>
		<email></email>
		<extension></extension>
		<home_phone></home_phone>
		<cell_phone></cell_phone>
		<jobtitle></jobtitle>
		<ssn></ssn>
		<driver_license_number></driver_license_number>
		<address></address>
		<city></city>
		<state></state>
		<postal_code></postal_code>
		<birth_date></birth_date>
		<date_hired></date_hired>
		<salary></salary>
		<notes></notes>
	</employee>
</employees>